{
  "deferred": [],
  "running": [],
  "schema_version": "state_snapshot.v1",
  "tick_at": "2026-09-21T09:31:59Z",
  "totals": {
    "deferred": 0,
    "running": 0,
    "tokens": {
      "input": 0,
      "output": 0,
      "total": 0
    },
    "tracking_issues": 2
  },
  "tracking_issues": [
    {
      "current_wave": 0,
      "issue_counts": {
        "closed": 0,
        "done": 0,
        "implementation_failed": 0,
        "in_progress": 0,
        "merged": 0,
        "not_created": 0,
        "ready_to_merge": 0,
        "review_blocked": 0,
        "skipped": 0
      },
      "number": 3965,
      "project_complete": false,
      "status": "in-progress",
      "title": "[Orchestrator] Deterministic contract-list union for orchestrator sync",
      "total_waves": 0,
      "wave_complete": false
    },
    {
      "current_wave": 0,
      "issue_counts": {
        "closed": 0,
        "done": 0,
        "implementation_failed": 0,
        "in_progress": 0,
        "merged": 0,
        "not_created": 0,
        "ready_to_merge": 0,
        "review_blocked": 0,
        "skipped": 0
      },
      "number": 4139,
      "project_complete": false,
      "status": "in-progress",
      "title": "[Orchestrator] Security pass convergence by project-line ownership",
      "total_waves": 0,
      "wave_complete": false
    }
  ]
}
