{
  "deferred": [],
  "running": [],
  "schema_version": "state_snapshot.v1",
  "tick_at": "2026-06-25T11:06:30Z",
  "totals": {
    "deferred": 0,
    "running": 0,
    "tokens": {
      "input": 0,
      "output": 0,
      "total": 0
    },
    "tracking_issues": 1
  },
  "tracking_issues": [
    {
      "current_wave": 4,
      "integration_ahead_by": "6",
      "issue_counts": {
        "closed": 0,
        "done": 2,
        "implementation_failed": 0,
        "in_progress": 0,
        "merged": 0,
        "not_created": 0,
        "ready_to_merge": 0,
        "review_blocked": 0,
        "skipped": 0
      },
      "number": 3496,
      "project_complete": false,
      "status": "in-progress",
      "title": "[Orchestrator] gstack learnings rollout for the unattended pipeline (Phases A\u2013P)",
      "total_waves": 15,
      "wave_complete": false
    }
  ]
}
