{
  "deferred": [],
  "running": [],
  "schema_version": "state_snapshot.v1",
  "tick_at": "2026-06-13T09:09:54Z",
  "totals": {
    "deferred": 0,
    "running": 0,
    "tokens": {
      "input": 0,
      "output": 0,
      "total": 0
    },
    "tracking_issues": 1
  },
  "tracking_issues": [
    {
      "current_wave": 2,
      "integration_ahead_by": "4",
      "issue_counts": {
        "closed": 0,
        "done": 0,
        "implementation_failed": 0,
        "in_progress": 0,
        "merged": 1,
        "not_created": 0,
        "ready_to_merge": 0,
        "review_blocked": 0,
        "skipped": 0
      },
      "number": 3303,
      "project_complete": false,
      "status": "waiting",
      "title": "[Orchestrator] GSD-inspired unattended-pipeline improvements (Phases B-E)",
      "total_waves": 4,
      "wave_complete": true
    }
  ]
}
