{
  "deferred": [],
  "running": [],
  "schema_version": "state_snapshot.v1",
  "tick_at": "2026-10-19T19:46:40Z",
  "totals": {
    "deferred": 0,
    "running": 0,
    "tokens": {
      "input": 0,
      "output": 0,
      "total": 0
    },
    "tracking_issues": 7
  },
  "tracking_issues": [
    {
      "current_wave": 0,
      "issue_counts": {
        "closed": 0,
        "done": 0,
        "implementation_failed": 0,
        "in_progress": 0,
        "merged": 0,
        "not_created": 0,
        "ready_to_merge": 0,
        "review_blocked": 0,
        "skipped": 0
      },
      "number": 7467,
      "project_complete": false,
      "status": "in-progress",
      "title": "[Orchestrator] Apply workflow-optimization-2026-09-20 recommendations (verified subset)",
      "total_waves": 0,
      "wave_complete": false
    },
    {
      "current_wave": 0,
      "issue_counts": {
        "closed": 0,
        "done": 0,
        "implementation_failed": 0,
        "in_progress": 0,
        "merged": 0,
        "not_created": 0,
        "ready_to_merge": 0,
        "review_blocked": 0,
        "skipped": 0
      },
      "number": 7490,
      "project_complete": false,
      "status": "in-progress",
      "title": "[Orchestrator] Apply workflow-optimization-2026-09-20-2 recommendations (verified subset)",
      "total_waves": 0,
      "wave_complete": false
    },
    {
      "current_wave": 0,
      "issue_counts": {
        "closed": 0,
        "done": 0,
        "implementation_failed": 0,
        "in_progress": 0,
        "merged": 0,
        "not_created": 0,
        "ready_to_merge": 0,
        "review_blocked": 0,
        "skipped": 0
      },
      "number": 7590,
      "project_complete": false,
      "status": "in-progress",
      "title": "[Orchestrator] Apply workflow-optimization-2026-09-21 recommendations (verified subset)",
      "total_waves": 0,
      "wave_complete": false
    },
    {
      "current_wave": 0,
      "issue_counts": {
        "closed": 0,
        "done": 0,
        "implementation_failed": 0,
        "in_progress": 0,
        "merged": 0,
        "not_created": 0,
        "ready_to_merge": 0,
        "review_blocked": 0,
        "skipped": 0
      },
      "number": 7604,
      "project_complete": false,
      "status": "in-progress",
      "title": "[Orchestrator] Report synced-file security findings to coding-workflows through heal intake",
      "total_waves": 0,
      "wave_complete": false
    },
    {
      "current_wave": 0,
      "issue_counts": {
        "closed": 0,
        "done": 0,
        "implementation_failed": 0,
        "in_progress": 0,
        "merged": 0,
        "not_created": 0,
        "ready_to_merge": 0,
        "review_blocked": 0,
        "skipped": 0
      },
      "number": 7614,
      "project_complete": false,
      "status": "in-progress",
      "title": "[Orchestrator] Apply workflow-optimization-2026-09-21-2 recommendations (verified subset)",
      "total_waves": 0,
      "wave_complete": false
    },
    {
      "current_wave": 0,
      "issue_counts": {
        "closed": 0,
        "done": 0,
        "implementation_failed": 0,
        "in_progress": 0,
        "merged": 0,
        "not_created": 0,
        "ready_to_merge": 0,
        "review_blocked": 0,
        "skipped": 0
      },
      "number": 7640,
      "project_complete": false,
      "status": "in-progress",
      "title": "[Orchestrator] Apply workflow-optimization-2026-09-21-3 recommendations (verified subset)",
      "total_waves": 0,
      "wave_complete": false
    },
    {
      "current_wave": 0,
      "issue_counts": {
        "closed": 0,
        "done": 0,
        "implementation_failed": 0,
        "in_progress": 0,
        "merged": 0,
        "not_created": 0,
        "ready_to_merge": 0,
        "review_blocked": 0,
        "skipped": 0
      },
      "number": 7679,
      "project_complete": false,
      "status": "in-progress",
      "title": "[Orchestrator] Apply workflow-optimization-2026-09-21-4 recommendations (verified subset)",
      "total_waves": 0,
      "wave_complete": false
    }
  ]
}
