{
  "deferred": [],
  "running": [],
  "schema_version": "state_snapshot.v1",
  "tick_at": "2026-10-28T13:01:27Z",
  "totals": {
    "deferred": 0,
    "running": 0,
    "tokens": {
      "input": 0,
      "output": 0,
      "total": 0
    },
    "tracking_issues": 3
  },
  "tracking_issues": [
    {
      "current_wave": 0,
      "issue_counts": {
        "closed": 0,
        "done": 0,
        "implementation_failed": 0,
        "in_progress": 0,
        "merged": 0,
        "not_created": 0,
        "ready_to_merge": 0,
        "review_blocked": 0,
        "skipped": 0
      },
      "number": 8188,
      "project_complete": false,
      "status": "in-progress",
      "title": "[Orchestrator] Pre-push affected-test gate: orchestrator scoping, implement / review / resolver / heal gates, integration post-sync test repair (plan P2-P5)",
      "total_waves": 0,
      "wave_complete": false
    },
    {
      "current_wave": 0,
      "issue_counts": {
        "closed": 0,
        "done": 0,
        "implementation_failed": 0,
        "in_progress": 0,
        "merged": 0,
        "not_created": 0,
        "ready_to_merge": 0,
        "review_blocked": 0,
        "skipped": 0
      },
      "number": 8218,
      "project_complete": false,
      "status": "in-progress",
      "title": "[Orchestrator] [E2E Orchestrate Smoke 40427433026] Update two smoke canary files in parallel",
      "total_waves": 0,
      "wave_complete": false
    },
    {
      "current_wave": 3,
      "integration_ahead_by": "7",
      "issue_counts": {
        "closed": 0,
        "done": 0,
        "implementation_failed": 0,
        "in_progress": 1,
        "merged": 0,
        "not_created": 0,
        "ready_to_merge": 0,
        "review_blocked": 0,
        "skipped": 0
      },
      "number": 8253,
      "project_complete": false,
      "status": "in-progress",
      "title": "[Orchestrator] Cut the unattended pipelines' static prompt prefix: agents.md index instead of inline",
      "total_waves": 4,
      "wave_complete": false
    }
  ]
}
