{
  "deferred": [],
  "running": [],
  "schema_version": "state_snapshot.v1",
  "tick_at": "2026-08-26T08:14:24Z",
  "totals": {
    "deferred": 0,
    "running": 0,
    "tokens": {
      "input": 0,
      "output": 0,
      "total": 0
    },
    "tracking_issues": 1
  },
  "tracking_issues": [
    {
      "current_wave": 3,
      "integration_ahead_by": "15",
      "issue_counts": {
        "closed": 0,
        "done": 1,
        "implementation_failed": 0,
        "in_progress": 0,
        "merged": 2,
        "not_created": 0,
        "ready_to_merge": 0,
        "review_blocked": 0,
        "skipped": 0
      },
      "number": 3810,
      "project_complete": false,
      "status": "in-progress",
      "title": "[Orchestrator] Triage and apply safe workflow optimizations from August 19-25",
      "total_waves": 3,
      "wave_complete": false
    }
  ]
}
