{
  "deferred": [],
  "running": [],
  "schema_version": "state_snapshot.v1",
  "tick_at": "2026-06-15T18:01:01Z",
  "totals": {
    "deferred": 0,
    "running": 0,
    "tokens": {
      "input": 0,
      "output": 0,
      "total": 0
    },
    "tracking_issues": 1
  },
  "tracking_issues": [
    {
      "current_wave": 0,
      "issue_counts": {
        "closed": 0,
        "done": 0,
        "implementation_failed": 0,
        "in_progress": 0,
        "merged": 0,
        "not_created": 0,
        "ready_to_merge": 0,
        "review_blocked": 0,
        "skipped": 0
      },
      "number": 3323,
      "project_complete": false,
      "status": "in-progress",
      "title": "[Orchestrator] Apply the safe subset of workflow-optimization-2026-06-13 recommendations",
      "total_waves": 0,
      "wave_complete": false
    }
  ]
}
